{
  "name": "Simplified Chinese to Traditional Chinese (Hong Kong variant, with phrases, Jieba Segmentation - Experimental)",
  "normalization": [
    {
      "dict": {
        "type": "ocd2",
        "file": "CJK_Compatibility_Ideographs.ocd2"
      }
    }
  ],
  "segmentation": {
    "type": "jieba",
    "resources": {
      "dict_path": "jieba_dict/jieba_merged.ocd2",
      "model_path": "jieba_dict/hmm_model.utf8"
    }
  },
  "conversion_chain": [
    {
      "dict": {
        "type": "group",
        "match_policy": "short_circuit",
        "dicts": [
          {
            "type": "group",
            "match_policy": "union",
            "dicts": [
              {
                "type": "ocd2",
                "file": "STPhrases.ocd2"
              },
              {
                "type": "ocd2",
                "file": "STPhrases_GeneratedFromRegionalPhrases.ocd2"
              }
            ]
          },
          {
            "type": "ocd2",
            "file": "STCharacters.ocd2"
          }
        ]
      }
    },
    {
      "dict": {
        "type": "group",
        "match_policy": "short_circuit",
        "dicts": [
          {
            "type": "ocd2",
            "file": "HKPhrases.ocd2"
          },
          {
            "type": "ocd2",
            "file": "HKVariantsPhrases.ocd2"
          },
          {
            "type": "ocd2",
            "file": "HKVariants.ocd2"
          }
        ]
      }
    }
  ]
}
